п/н";"Объект";"Адрес";"Округ";"Компания";"Менеджер";"Период обслуживания";"Latitude";"Longitude";"Дата последнего ТО"
"137613";"Московская обл, г.о. Щёлково, рп Фряново, ул Молодежная, стр. 9Б";"ООО «ВсеИнструменты.ру»/Пункт выдачи ""Всеинструменты""";"-";"-";"-";"КВ";"-";"-";"-"
"52272 Т";"ИП Нюхтилин Денис Михайлович/Сеть салонов «Оптимист Оптика»,";"Балашиха, мкрн. Заря, Маршала Батицкого 12А";"-";"-";"-";"КВ";"-";"-";"-"
"82645/82652";"Центр Флебологии""(медицинский центр)";"Москва Радио, д.10, стр.9";"-";"-";"-";"КВ";"-";"-";"-"
"ТО- 778ТБ";"ИП Кущ Евгения Андреевна/Салон Красоты";"г Реутов, Носовихенское шоссе, д. 25";"-";"-";"-";"КВ";"-";"-";"-"
"ТО-152";"Салон красоты, ООО Аурум,";"Москва, Вешняковская 25к1";"-";"-";"-";"КВ";"-";"-";"-"
"ТО-173";"ИП Модников Павел Евгеньевич/коммерческое помещение";"Москва г, Перовская ул, дом 66, корпус 6";"-";"-";"-";"КВ";"-";"-";"-"
"ТО-176ТБ";"ООО «ЭГМАЛ» (Магазин Продукты";"Балашиха , Первомайский проезд, дом 1";"-";"-";"-";"КВ";"-";"-";"-"
"ТО-211ТБ";"ИП Погосян Г.А./Детейлинг-автомойка FIRST PLACE DETAILING «CAR WASH»";"Московская обл, Реутов г, МКАД 2 км ул, дом 2";"-";"-";"-";"КВ";"-";"-";"-"
"ТО-22";"Пекарня Маман, ИП Петросян";"Москва, Семеновская площадь 7к17";"-";"-";"-";"КВ";"-";"-";"-"
"ТО-258ТБ";"ИП Инжеватова Вера Борисовна/ПВЗ ВАЛДБЕРРИЗ";"Московская обл, Щелковский р-н, Щелково г, Чкаловская ул, дом 4б";"-";"-";"-";"КВ";"-";"-";"-"
"ТО-29";"Салон красоты, ИП Хачатрян,";"Москва, Новокосинская 11к1";"-";"-";"-";"М";"-";"-";"-"
"ТО-3512";"ООО ""(А.А.) Л.Дизайн""/производственное помещение";"Москва г, Авиамоторная ул, дом № 22/12";"-";"-";"-";"КВ";"-";"-";"-"
"ТО-63";"ИП Конышева, школа скорочтения,";"Балашиха, Железнодорожный мкр. Проспект Героев 3";"-";"-";"-";"М";"-";"-";"-"
"ТО-№282ТБ";"ИП Корчагин Дмитрий Вячеславович (кафе «Хочу шаурму»)";"Москва г, Авиамоторная ул, дом 6, строение 4";"-";"-";"-";"КВ";"-";"-";"-"
"ТО-№355ТБ";"ИП Филиппов Василий Алексеевич/(Барбершоп «Черная кость»";"Московская обл, Балашиха г, Балашихинское ш, дом № 10";"-";"-";"-";"КВ";"-";"-";"-"
"ТО-№424ТБ";"ООО ""МЕДКЛАССИКА""/стоматология";"Москва г, 2-я Кабельная ул, дом 10";"-";"-";"-";"КВ";"-";"-";"-"
"ТО-№455ТБ";"ИП Зейналов Вагиф, Французская пекарня Седелис Френч Баккерри,";"Москва г, 1-я Владимирская ул, дом № 39/12";"-";"-";"-";"КВ";"-";"-";"-"
"-";"-";"-";"-";"-";"-";"КВ";"-";"-";"-"
"-";"-";"-";"-";"-";"-";"КВ";"-";"-";"-"
"-";"-";"-";"-";"-";"-";"КВ";"-";"-";"-"
"-";"-";"-";"-";"-";"-";"КВ";"-";"-";"-"
"-";"-";"-";"-";"-";"-";"М";"-";"-";"-"
"-";"-";"-";"-";"-";"-";"КВ";"-";"-";"-