"дата ";"П/н";"Адрес";"район/направление/метро";"Обьект";"Демонтировать ДО ";"Ссылка на ФЗЧ";"Статус заявки";"телефон хоз";"Менеджер";"Исполнитель Заявки";"Комментарий техника";"Latitude";"Longitude"
"04.09.2023";"91131";"МО Воскресенский район пгт Белоозерский ул 50 лет Октября 21";"Белоозерский";"Магазин Красное и Белое ";"до 06.09.2023";"в карточке трелло ";"назначено";"9260747716";"Сергеев Сергей Валерьевич, Тел: 7 916 445 37 60";"Ковалев 08.09.2023";"никита будет разбираться когда нибудь ";"55.4465638";"38.4749691"
"11.07.2024";"39053";"Москва, Рязанский пр-кт, д. 25";"стахановская ";"Аптека";"Thu Jul 18 2024 03:00:00 GMT+0300 (Moscow Standard Time)";"Кайтен";"не назначено";"Контакт Коруд Ольга Владимировна 8977 442-42-84 . ЕЕ ЗАРАНЕЕ НАБРАТЬ!!!!!!!!!!";"Пряшников Дмитрий ";"Сняли Жабу ";"-";"55.7303835";"37.7459985"
"12.08.2024";"136900??";"г. Видное, д. Сапроново, квартал Северный, д. 2";"Сапроново";"Пекарня";"до 23.07.2024";"Кайтен";"не назначено";": 7 985 817 13 38";"Рощин Сергей Сергеевич, Тел: 7 985 817 13 38";"-";"-";"55.537011";"37.72157"
"19.08.2024";"84985";"Московская обл, Ленинский р-н, Суханово д, ЖК ""Суханово Парк"", дом 38, корпус 1";"Суханово-парк";"Щеголькова Наталья Николаевна (BUH3), кв,";"Thu Aug 15 2024 03:00:00 GMT+0300 (Moscow Standard Time)";"нет";"не назначено";"ТЕЛЕФОН КЛИЕНТА ДЛЯ ДЕМОНТАЖА: 89255023234  ФИО: (Владимир) Сын 89266321122";"Супонников Михаил Сергеевич, Тел: 7 916 125 90 13 ";"в собстености ";"-";"55.523438";"37.6433373"
"19.08.2024";"300061";" Московская обл, г Одинцово, ш Можайское,, д. 22";"Одинцово";"МАШУК+ ООО , магазин";"Thu Aug 15 2024 03:00:00 GMT+0300 (Moscow Standard Time)";"нет";"не назначено";"ТЕЛЕФОН КЛИЕНТА ДЛЯ ДЕМОНТАЖА: 89688000053  ФИО: Иракли";"Супонников Михаил Сергеевич, Тел: 7 916 125 90 13 ";"в собстености ";"-";"55.675295";"37.2793109"
"21.08.2024";"130376";" МО, г. Домодедово, ул. Корнеева 4Б";"домодедово";"Продуктовый магазин Куриный Дом ООО Доркинг";"Mon May 13 2024 03:00:00 GMT+0300 (Moscow Standard Time)";"кайтен";"не назначено";"Телефон: 8-964-785-79-00";"Пряшников Дмитрий Юрьевич, Тел: 7 985 318 01 16";"-";"-";"55.4374295";"37.7727603"
"05.09.2024";"136088";"Красногорск, Спасская улица, 1к2";"Волоколамская ";"Детский сад Горница Узорница";"Fri Sep 06 2024 03:00:00 GMT+0300 (Moscow Standard Time)";"кайтен";"не назначено";"8(925)306-77-76 ФИО: Панфёров Александр Вячеславович, ";"Сафин Максим Сергеевич, Тел: 8-999-628-70-15";"-";"-";"55.826704";"37.369605"
"05.09.2024";"133897";"Котельники, Сосновая улица, 1к2";"Котельники ";"Детский сад Горница Узорница";"Fri Sep 06 2024 03:00:00 GMT+0300 (Moscow Standard Time)";"кайтен";"не назначено";"8(925)306-77-76 ФИО: Панфёров Александр Вячеславович, ";"Сафин Максим Сергеевич, Тел: 8-999-628-70-15";"-";"-";"55.67207140000001";"37.8556995"
"05.09.2024";"134395";"Химки, улица Калинина, 11";"Химки";"Детский сад Горница Узорница";"Fri Sep 06 2024 03:00:00 GMT+0300 (Moscow Standard Time)";"кайтен";"не назначено";"8(925)306-77-76 ФИО: Панфёров Александр Вячеславович, ";"Сафин Максим Сергеевич, Тел: 8-999-628-70-15";"-";"-";"55.8875986";"37.4453831"
"05.09.2024";"137651";"Москва, Варшавское шоссе, 282к1";"Щербинка";"Овощи фрукты";"Thu Sep 05 2024 03:00:00 GMT+0300 (Moscow Standard Time)";"кайтен";"назначено";"8 (985) 578-32-23 ФИО: Шабанов Музаффар Узеир оглы ";" Калиниченко Анатолий Сергеевич, Тел: 7 966 124 77 00	";"даниелян 09.09.224";"-";"55.5250226";"37.5790247"
"06.09.2024";"136653";"Москва, 4-й Стрелецкий проезд, 13";"Савёловская ";"Офис";"Mon Sep 09 2024 03:00:00 GMT+0300 (Moscow Standard Time)";"кайтен";"назначено";" 7 968 608-26-80, Тел: 7 968 483-77-77 ФИО: Сергеева Стелла Витальевна,. Сергеева Стелла Витальевна,";"Хорзов Сергей Валерьевич, Тел: 8-905-392-55-66";"андрущенко 09.09.2024";"-";"55.7959897";"37.6011633"
"10.09.2024";"134858";"Москва, 2-я Останкинская улица, 3";"улица академика королева ";"Французская пекарня Седелисе Френч Баккерри";"Tue Sep 10 2024 03:00:00 GMT+0300 (Moscow Standard Time)";"кайтен";"назначено";" Олег+7 977 849-88-29";"Михно С.С.";"терехов 10.09.2024";"-";"55.8257772";"37.6249881"
"10.09.2024";"136411";"Москва, Воротынская улица, 16";"путилково";" бар-ресторан ""ЛЕОНА";"Tue Sep 10 2024 03:00:00 GMT+0300 (Moscow Standard Time)";"кайтен";"назначено";"8-926-566-75-64 ФИО: Болдырева Екатерина Андреевна ";"Чиграй А";"терехов 10.09.2024";"-";"55.89006819999999";"37.3941777"
"10.09.2024";"133188";"Москва, улица Маршала Савицкого, 18к1";"Щербинка";"Пункт выдачи заказов Вайлдберрис";"Tue Sep 10 2024 03:00:00 GMT+0300 (Moscow Standard Time)";"кайтен";"назначено";" +79031535729,+79140881777, ФИО: Громова Олеся Михайловна MyAlarm, Афанасьев Виталий Валерьевич ";" Гаук Евгений Михайлович, Тел: 7 9773939462";"даниелян 10.09.2024";"-";"55.5051012";"37.5899869"
"10.09.2024";"136626";"Дмитров, 2-я Комсомольская улица, 11/1";"Дмитров";"Частная школа	";"Wed Sep 11 2024 03:00:00 GMT+0300 (Moscow Standard Time)";"кайтен";"не назначено";"8 926 284 92 35, 8 926 466 76 02	 ФИО: Козин Анатолий Алексеевич , Оповещение¶2. Козина Наталья Александровна ";"Самойлов";"-";"-";"56.334103";"37.538663"
"01.04.2024";"1480";"Коломна, проезд Станкостроителей, 17А";"Коломна";" Склад";"до 03.04.2024";"кайтен";"назначено";"7 926 501-11-74 Сергей Борисович";"Моторин Александр Валентинович, Тел: 7 926 40012 34";"федосов ";"-";"55.0719461";"38.7774775"
"13.09.2024";"134288";"посёлок Коммунарка, улица Александры Монаховой, 96к2";"потапово";"Кафе ""Место"" ";"Fri Sep 13 2024 03:00:00 GMT+0300 (Moscow Standard Time)";"кайтен";"назначено";"Дмитрий — 89652137090.";" Мозговой Иван - 89629905127.";"Даниелян 13.09.2024";"-";"55.56446709999999";"37.4862021"
"13.09.2024";"136180";"Куровское, Советская улица, 101";"орехово зуево";"доброцен";"Fri Sep 13 2024 03:00:00 GMT+0300 (Moscow Standard Time)";"кайтен";"назначено";"-";"Севрюков";"ковалев 13.09.2024";"-";"55.5792097";"38.9219189"
