п/н";"Объект";"Адрес";"Округ";"Компания";"Менеджер";"Период обслуживания";"Latitude";"Longitude";"Дата последнего ТО"
"1129";"Аптека ""Планета Здоровья""";", г.Москва, Менжинского д.32к3";"-";"-";"-";"М";"-";"-";"-"
"1154";"Нотариус";"г.Мытищи, 1-й трудовой переулок д.7";"-";"-";"-";"КВ";"-";"-";"-"
"1217";"ООО «МедОк» (Клиника «Инвитро»)";"г. Москва, ул. Малыгина, д. 22 корп.1";"-";"-";"-";"КВ";"-";"-";"-"
"1278";"ИП Данилов Андрей Николаевич (Пекарня «Хлебница»)";"г.Москва, Сущевский вал 59";"-";"-";"-";"КВ";"-";"-";"-"
"1313";"ИП Варицкая Татьяна Викторовна Частный детский сад «Sun School»";". г. Москва, ул. Олонецкая, 4, подъезд №2";"-";"-";"-";"КВ";"-";"-";"-"
"1432";"ООО «РЕНТ ЦЕНТРАЛЬ»/ Ломбард Благо";"г. Москва, Алтуфьевское ш, дом 86";"-";"-";"-";"КВ";"-";"-";"-"
"1514";"ИП Фатыхов Хатиф Такиевич /салон красоты";"Москва, Абрамцевская улица, дом 11, корп. 3";"-";"-";"-";"М";"-";"-";"-"
"1562";"ООО ""Авис Гранд"" салон красоты Эвелин,";"Москва, Ростокинская, д.1";"-";"-";"-";"КВ";"-";"-";"-"
"7704";"ИП Алиев Захид, TODA PIZZA,";"Москва г, Складочная ул, дом 8, корпус 1";"-";"-";"-";"КВ";"-";"-";"-"
"39577";"ООО «МедОк» (Клиника «Инвитро»)";"г. Москва, ул. Широкая, д.7 корп.1";"-";"-";"-";"КВ";"-";"-";"-"
"39578";"ООО «МедОк» (Клиника «Инвитро»)";"г. Москва, ул. Менжинского 32к3";"-";"-";"-";"КВ";"-";"-";"-"
"39800";"ООО ""ОЛИМП"" /Аптека Планета Здоровья,";"Пушкино г, Пушкинский р-н, Московская обл мкр.Новая Деревня, Набережная ул, дом 35, корпус 1";"-";"-";"-";"КВ";"-";"-";"-"
"45498";"Магазин ""Пиво"" ИП Толмачев,";"г.Москва, ул. Летчика Бабушкина, д.31";"-";"-";"-";"КВ";"-";"-";"-"
"46812";"М-н «Красное белое»";"г. Москва, ул. Руставели 1/2";"-";"-";"-";"КВ";"-";"-";"-"
"47944";"магазин ""Красное Белое""";"Москва ул. Дмитровское шоссе, д.90/1";"-";"-";"-";"КВ";"-";"-";"-"
"50795";"ИП Кан Елена Павловна Магазин «Суши Стор»";"г. Москва, ул. Изумрудная д, 18";"-";"-";"-";"КВ";"-";"-";"-"
"83983";"ООО «Яндекс Маркет» Офис";"Москва, ул. Полковая дом 3";"-";"-";"-";"КВ";"-";"-";"-"
"90303";"М-н «Красное белое»";"г. Москва, ул. Милашенкова 3, корп. 1";"-";"-";"-";"КВ";"-";"-";"-"
"90325";"Аптека""Планета Здоровья""";"г. Пересвет, ул. Королева, д.10 СВАО";"-";"-";"-";"КВ";"-";"-";"-"
"90423";"М-н «Красное белое»";"г. Москва, Дмитровское шоссе 74, к.1";"-";"-";"-";"КВ";"-";"-";"-"
"90451";"ООО ""ЛАБОРАТОРИЯ ЗДОРОВЬЯ""/Медицинский центр";"Московская обл, Мытищи г, Колпакова ул, дом № 10";"-";"-";"-";"М";"-";"-";"-"
"90541";"«ВсеИнструменты.ру»";"Московская обл, Пушкинский р-н, Пушкино г, Писаревская ул, дом № 2";"-";"-";"-";"КВ";"-";"-";"-"
"90628";"М-н «Красное белое»";"г. Москва, Дмитровское шоссе 46, корп. 1";"-";"-";"-";"КВ";"-";"-";"-"
"90957";"Планета Здоровья,";"Мытищи, Новомытищинский проспект 12к1";"-";"-";"-";"М";"-";"-";"-"
"90962";"Аптека ""Планета Здоровья""";", г. Москва, ул. Яблочкова д.21";"-";"-";"-";"М";"-";"-";"-"
"91039";"ИП Правашинский В В магазин ""Школьная форма, одежда и обувь.";"МО г. Королёв ул. Циолковского 10.";"-";"-";"-";"КВ";"-";"-";"-"
"91290";"ООО «ЦСМ» Центр семейной медицины";"г. Москва, Бескудниковский бул., д. 38, к. 1";"-";"-";"-";"КВ";"-";"-";"-"
"91401";"ИП Мусаев, Цветы 24,";"Москва, ул. Пр-т Мира, д.146";"-";"-";"-";"КВ";"-";"-";"-"
"91439";"магазин ""Оливия";"Москва проспект Мира 79";"-";"-";"-";"КВ";"-";"-";"-"
"91542";"ИП Данилов Андрей Николаевич (Пекарня «Хлебница»)";"Москва, Проспект мира 146,";"-";"-";"-";"КВ";"-";"-";"-"
"91710";"Красное и Белое";"г. Москва, Проспект мира 124к.1";"-";"-";"-";"КВ";"-";"-";"-"
"92225";"ООО «Ирамед»/Медицинский офис ""Анализы ДНКОМ""";"Московская обл, Королев г, Циолковского ул, дом 25";"-";"-";"-";"КВ";"-";"-";"-"
"93053";"Аптека Планета Здоровья,";"МО, г. Пушкино, Московский проспект 8/2";"-";"-";"-";"М";"-";"-";"-"
"93076";"Аптека ""Планета Здоровья""";"г. Москва, ул. Дубнинская, д.44а";"-";"-";"-";"М";"-";"-";"-"
"93119";"Аптека ""Планета Здоровья""";"Москва, Сущевский Вал, д. 67";"-";"-";"-";"М";"-";"-";"-"
"93123";"Аптека ""Планета Здоровья""";"г. Москва, проезд Шокальского д.11";"-";"-";"-";"М";"-";"-";"-"
"93275";"Салон Оптика, ООО Восход, ООО Ленц,";"Мытищи, ул. Воровского, д.5";"-";"-";"-";"КВ";"-";"-";"-"
"130176";"ООО «ВсеИнструменты.ру»/Магазин «Все Инструменты»";"Московская обл, Мытищи г, Новомытищинский проспект , дом 12к1";"-";"-";"-";"КВ";"-";"-";"-"
"130238";"ООО «СЕТЬ СОЦИАЛЬНЫХ АПТЕК «СТОЛИЧКИ»/аптека «Столички»";"Москва, Ярославское шоссе, д. 142, корп. 5";"-";"-";"-";"КВ";"-";"-";"-"
"130242";"Аптека Планета Здоровья.";"г.Королёв, Тихонравова 35к7";"-";"-";"-";"М";"-";"-";"-"
"130306";"ИП Заславский Павел Юрьевич/Грин Парк Салон";"Москва, Березовая аллея 17к2";"-";"-";"-";"КВ";"-";"-";"-"
"130592";"ООО «Феникс», Маркет-Гастроном";"г. Москва, Ясный проезд, д. 10";"-";"-";"-";"КВ";"-";"-";"-"
"130593";"аптека Планета здоровья,";"Мытищи, ул Мира 39";"-";"-";"-";"М";"-";"-";"-"
"130926";"ИП Барашков Сергей Борисович (Коммерческое помещение)";"Московская обл, Пушкинский р-н, Пушкино г, Вокзальная ул, владение 2Б";"-";"-";"-";"КВ";"-";"-";"-"
"131050";"ООО «ФЭМИЛИДЕНТ» (Стоматология ""Family Dent""),";"Московская обл., г. Ивантеевка, ул. Ленина, д. 16";"-";"-";"-";"М";"-";"-";"-"
"131321";"ООО ""Голден"" (Медицинский центр INVITRO)";"г. Москва, ул. Олонецкая, дом 4";"-";"-";"-";"КВ";"-";"-";"-"
"131536";"ООО «Орион» (Магазин «Ассортида»)";"Московская обл, Королев г, Пионерская ул, дом № 8Г";"-";"-";"-";"КВ";"-";"-";"-"
"131855";"ООО «ЦМЗ «МеМенто»";"г. Москва, ул. Ленская, д. 28";"-";"-";"-";"КВ";"-";"-";"-"
"131958";"Религиозная организация «Подворье Патриарха Московского и всея Руси храма Живоначальной Троицы в Свиблово г. Москвы Русской Православной Церкви (Московский Патриархат)» Воскресная школа";"Москва г, Берёзовая аллея, владение № 5/1.";"-";"-";"-";"КВ";"-";"-";"-"
"131974";"ООО ""Планета Здоровья Холдинг"" / Аптека Планета Здоровья";"Московская обл, Мытищи г, Астрахова пр-кт, дом 5";"-";"-";"-";"КВ";"-";"-";"-"
"131976";"Планета Здоровья Холдинг"" / Аптека Планета Здоровья";"Московская обл, Мытищи г, Юбилейная ул, дом № 6";"-";"-";"-";"КВ";"-";"-";"-"
"131996";"ООО ""Аджента""/ аптека Планета Здоровья";"Москва г, Алтуфьевское ш, дом № 88";"-";"-";"-";"КВ";"-";"-";"-"
"132059";"ООО ""Планета Здоровья Холдинг"" / Аптека Планета Здоровья";"Московская обл, Мытищи г, Заречная ул, дом № 5";"-";"-";"-";"КВ";"-";"-";"-"
"132085";"ООО «Система»/Пекарня «Буханка»";"Москва г Олонецкая ул, дом № 4";"-";"-";"-";"КВ";"-";"-";"-"
"132097";"ООО Альфа-М магзин КБ";"Москва Псковская ул, дом № 5, корпус 4";"-";"-";"-";"КВ";"-";"-";"-"
"132098";"ООО Альфа-М магзин КБ";"Москва Шокальского проезд, дом № 31, корпус 1";"-";"-";"-";"КВ";"-";"-";"-"
"132103";"ООО Альфа-М магзин КБ";"Москва Руставели ул, дом 15";"-";"-";"-";"КВ";"-";"-";"-"
"132287";"ООО «Смарт Фэмили» (Склад)";"Москва г, Юрловский проезд, дом № 2, строение 1";"-";"-";"-";"М";"-";"-";"-"
"132313";"ООО «ПРОФИНВЕСТ-3» (Гастромаркет «ЕДА»";"Москва Трифоновская ул, дом № 56";"-";"-";"-";"КВ";"-";"-";"-"
"132427";"ООО Альфа-М магзин КБ,";"Москва Академика Королева ул, дом № 28, корпус 1";"-";"-";"-";"КВ";"-";"-";"-"
"132462";"ИП Гришаева Ирина Павловна (Табак)";"Москва г, Дмитровское ш, дом 68";"-";"-";"-";"КВ";"-";"-";"-"
"132583";"ООО «Система»/Пекарня Буханка";"Московская обл, Мытищи г, Мира ул, дом № 37";"-";"-";"-";"КВ";"-";"-";"-"
"132594";"ООО ""Фаэлит""/ Аптека Планета Здоровья";"Москва г, Коминтерна 15";"-";"-";"-";"КВ";"-";"-";"-"
"132626";"ООО «ВсеИнструменты.ру»";"Ивантеевка г, Новая Слобода ул, дом 4";"-";"-";"-";"КВ";"-";"-";"-"
"132631";"ООО ""ЗДОРОВЬЕ""/Аптека Планета Здоровья";"Московская обл, Пушкинский р-н, Пушкино г, Московский пр-кт, дом 5";"-";"-";"-";"КВ";"-";"-";"-"
"132689";"ООО ""ЗДОРОВЬЕ""/Аптека Планета Здоровья";"Московская обл, Мытищи г, Юбилейная ул, дом 4";"-";"-";"-";"КВ";"-";"-";"-"
"132705";"ООО ""Азон"" /аптека Планета Здоровья";"Московская обл Мытищи г, Мира ул, дом 35";"-";"-";"-";"КВ";"-";"-";"-"
"132790";"ООО ""ЗДОРОВЬЕ""/Аптека Планета Здоровья";"Московская обл, Пушкинский р-н, Пушкино г, Московский пр-кт, дом 21";"-";"-";"-";"КВ";"-";"-";"-"
"132874";"ИП Артамонова Надежда Федоровна Детский магазин";"г. Москва, ул. Сельскохозяйственная, д.35";"-";"-";"-";"КВ";"-";"-";"-"
"133038";"ООО «Восход»/Пекарня Буханка Москва";"г, Новоалексеевская ул, дом 16, корпус 3";"-";"-";"-";"КВ";"-";"-";"-"
"133075";"ООО ""ЗДОРОВЬЕ""/Аптека Планета Здоровья";"Московская обл, Пушкинский р-н, Пушкино г, Просвещения ул, дом 10, корпус 3";"-";"-";"-";"КВ";"-";"-";"-"
"133076";"ООО «ВОСХОД/Пекарня Буханка";"Москва г, Красная Сосна ул, дом 3, корпус 1";"-";"-";"-";"КВ";"-";"-";"-"
"133104";"ООО «ЧИСС Групп» (ЛАБОРАТОРИЯ ""ГЕМОТЕСТ"")";"Москва г, Декабристов ул, дом 10, корпус 3";"-";"-";"-";"КВ";"-";"-";"-"
"133214";"ООО «МЕДСЕРВИС-85» (Стоматологическая клиника «СТОМАТОЛОГИЯ»)";"Москва г, Бескудниковский б-р, дом 32, корпус 6";"-";"-";"-";"КВ";"-";"-";"-"
"133309";"ГОСУДАРСТВЕННОЕ КАЗЕННОЕ УЧРЕЖДЕНИЕ ДОПОЛНИТЕЛЬНОГО ПРОФЕССИОНАЛЬНОГО ОБРАЗОВАНИЯ ""УЧЕБНО-МЕТОДИЧЕСКИЙ ЦЕНТР ПО ГРАЖДАНСКОЙ ОБОРОНЕ И ЧРЕЗВЫЧАЙНЫМ СИТУАЦИЯМ ГОРОДА МОСКВЫ""";"Москва г, Гончарова ул, дом 17, корпус 2";"-";"-";"-";"М";"-";"-";"-"
"133310";"ООО ""Планета Здоровья Холдинг"" / Аптека Планета Здоровья";"Московская обл, Мытищи г, Юбилейная ул, дом 10";"-";"-";"-";"КВ";"-";"-";"-"
"133482";"ООО «ВсеИнструменты.ру»/Пункт выдачи ""Всеинструменты""";"Пушкино г, Ярославское ш, дом 114";"-";"-";"-";"КВ";"-";"-";"-"
"133644";"ИП Брюлина В.Д./Пекарня «Буханка»";"Московская обл, Мытищи г, Тенистый б-р, дом 8";"-";"-";"-";"КВ";"-";"-";"-"
"133739";"ИП Коннова Елена (Кофейня « Surf Coffee x Pease»)";"Москва г, Мира пр-кт, дом 99";"-";"-";"-";"КВ";"-";"-";"-"
"133879";"ООО ФАТОШКА/Салон красоты";"Москва г, Фонвизина ул, дом 4";"-";"-";"-";"КВ";"-";"-";"-"
"133881";"ООО «ВОСХОД»/ Пекарня Буханка";"г.Москва , ул.Фонвизина 18";"-";"-";"-";"КВ";"-";"-";"-"
"133943";"ООО «Виктория» (Медицинский офис INVITRO)";"Москва г, Бутырская ул, дом 9, корпус 1";"-";"-";"-";"КВ";"-";"-";"-"
"134066";"ООО «ВОСХОД»/ Пекарня Буханка";"Москва г, Полярная ул, дом 27, корпус 2";"-";"-";"-";"КВ";"-";"-";"-"
"134067";"ООО «Система»/Пекарня Буханка";"Москва г, Тайнинская ул, дом 9";"-";"-";"-";"КВ";"-";"-";"-"
"134184";"ИП Хмеленко О.А./Гастроном «Фермер»";"Москва г, Дубнинская ул, дом 12, корпус 2";"-";"-";"-";"КВ";"-";"-";"-"
"134270";"ИП Еремеев Е.С./кофейня-кондитерская «Вкусный Выбор»";"Москва г, Сельскохозяйственная ул, дом № 35";"-";"-";"-";"КВ";"-";"-";"-"
"134305";"ООО «АлХрис», Хостел «Христал Савёловская»,";"Москва г, Расковой ул, дом 34, корпус 13Б";"-";"-";"-";"КВ";"-";"-";"-"
"134337";"ООО ""Аэросистемы"" офис";"г. Москва, ул. 2-й Ботанический проезд 6";"-";"-";"-";"КВ";"-";"-";"-"
"134419";"ИП Невская О.А. Пекарня Буханка";"Москва г, Складочная ул, дом № 8, корпус 1";"-";"-";"-";"КВ";"-";"-";"-"
"134421";"ООО «ВОСХОД»/ Пекарня Буханка";"МО , г. Мытищи, ул.Астрахова , д.5";"-";"-";"-";"КВ";"-";"-";"-"
"134492";"ИП Евтухова Евгения Сергеевна/(Кофейня «P3 COFFEE»).";"Москва г, Бескудниковский б-р, дом № 13";"-";"-";"-";"КВ";"-";"-";"-"
"134569";"ИП Демчик Владимир Иванович (Шаурма (Бистро),";"Москва г, Дмитровское ш, дом № 68";"-";"-";"-";"КВ";"-";"-";"-"
"134867";"ООО «Мой Ломбард»,";"Московская обл, Пушкинский р-н, Пушкино г, Вокзальная ул, дом 1с2";"-";"-";"-";"КВ";"-";"-";"-"
"135131";"ООО «ВИАМ-Фарм» (Аптека)";"Москва г, Марфинская Б. ул, дом 4, корпус 4";"-";"-";"-";"КВ";"-";"-";"-"
"135200";"ООО ""Дом геодезии""/офис";"Московская обл, Мытищи г, Ярославское ш, дом 105";"-";"-";"-";"КВ";"-";"-";"-"
"136066";"ИП Худякова Анастасия Алексеевна/(Кладовка ""СКЛАДНО"")";"Московская обл, Мытищи г, Мира ул, дом 32А";"-";"-";"-";"КВ";"-";"-";"-"
"136096";"ООО «КУЛИНА»/(Кулинария «ВИЛКА», Домашняя Еда),";"Москва г, Гостиничный проезд, дом № 8, корпус 1";"-";"-";"-";"КВ";"-";"-";"-"
"136101";"ООО «Сдобный Край»/(пекарня «Хлебница»)";"Москва г, Хачатуряна ул, дом 16";"-";"-";"-";"КВ";"-";"-";"-"
"136103";"ООО ""Крона-Мед""/стоматологическая клиника ""DREAM""";"Москва г, Чичерина ул, дом 8, корпус 2";"-";"-";"-";"КВ";"-";"-";"-"
"136181";"ИП Гордеев Михаил Юрьевич/Кладовка ""СКЛАДНО""";"Москва г, Алтуфьевское ш, дом № 28";"-";"-";"-";"КВ";"-";"-";"-"
"136264";"ООО «ВсеИнструменты.ру»/Пункт выдачи ""Всеинструменты""";"Московская обл, Красноармейск г, Первомайская ул, дом 2а";"-";"-";"-";"КВ";"-";"-";"-"
"136509";"ООО «Кубомер»/Пиццерия ""Грани сыра""";"Мытищи г, Сухарево д, Дмитровское ш, дом 20";"-";"-";"-";"КВ";"-";"-";"-"
"136549";"ИП Борщенко Ирина Владимировна/Нежилое помещение";"Москва, Берёзовая аллея 17к1";"-";"-";"-";"М";"-";"-";"-"
"136590";"ООО «СТРЕЛЬБИЩЕНСКИЙ» Магазин «Пятерочка»";"Московская обл, Котельники г, Сосновая ул, дом № 5, корпус 1";"-";"-";"-";"КВ";"-";"-";"-"
"136645";"ИП Львов Евгений Александрович, Кладовка ""СКЛАДНО""";"Москва г, Новоалексеевская ул, дом № 23";"-";"-";"-";"КВ";"-";"-";"-"
"136733";"ИП Касаткин Георгий Иванович (Магазин «ЦентрФуд»)";"Москва г, Ярославское ш, дом № 2, корпус 2";"-";"-";"-";"КВ";"-";"-";"-"
"136784";"ООО «КОСТЯКОВА К» (Гастромаркет «ЕДА»)";", Москва г, Костякова ул, дом № 6/5";"-";"-";"-";"КВ";"-";"-";"-"
"136849";"ООО «АПТЕЧНЫЙ СКЛАД «ПОДМОСКОВЬЕ», аптека,";"Москва г, Ярославское ш, дом № 12, корпус 2";"-";"-";"-";"КВ";"-";"-";"-"
"136860";"Пункт выдачи ""ВсеИнструменты""";"Сергиево-Посадский г. Пересвет ул. Комсомольская 10";"-";"-";"-";"КВ";"-";"-";"-"
"136924";"ООО «ВсеИнструменты.ру»/Пункт выдачи ""Всеинструменты"",";"Москва, Алтуфьевское шоссе 80";"-";"-";"-";"КВ";"-";"-";"-"
"137003";"ООО «ВОСХОД»/ Пекарня Буханка";"Москва г, вн.тер.г. муниципальный округ Останкинский, аллея Берёзовая, д. 19, к. 2";"-";"-";"-";"КВ";"-";"-";"-"
"137019";"ООО «АЛТУФЬЕВО К» (Гастромаркет ""ЕДА"")";"Москва г, вн.тер.г. муниципальный округ Бибирево, ш Алтуфьевское, д. 80";"-";"-";"-";"КВ";"-";"-";"-"
"137258";"ИП Шипот Максим Владимирович (Магазин «ЦентрФуд""";"Москва г, ул Декабристов, д. 6, к. 1";"-";"-";"-";"КВ";"-";"-";"-"
"137260";"ООО «ВсеИнструменты.ру»/Пункт выдачи ""Всеинструменты""";"Московская обл, г.о. Истра, д Высоково, ул Центральная, зд. 40";"-";"-";"-";"КВ";"-";"-";"-"
"137555";"ООО «Мой Ломбард»/Ломбард";"Мытищи ул.Колонцова,д.1";"-";"-";"-";"КВ";"-";"-";"-"
"151452";"ООО «РЕНТ ЦЕНТРАЛЬ»/ Ломбард Благо";"Москва г, Заревый проезд, дом 10";"-";"-";"-";"КВ";"-";"-";"-"
"151489";"ООО «Мой Ломбард»";"Москва г, Сигнальный проезд, дом № 6А ";"-";"-";"-";"КВ";"-";"-";"-"
"90987- 90369";"Салон красоты, ИП Нечаева М.М.";"г. Королев, ул. Горького, д. 79к13";"-";"-";"-";"КВ";"-";"-";"-"
"ТО-1534";"ИП Анакин Сергей Владимирович";"г. Москва, Дмитровское шоссе, дом 124 А";"-";"-";"-";"КВ";"-";"-";"-"
"ТО-221ТБ";"ИП Табачникова Галина Владимировна (Магазин цветов FlowFix)";"Москва г, Бутырская ул, дом 84";"-";"-";"-";"КВ";"-";"-";"-"
"ТО-2609";"Мастер отель ИП Громов П В";"г.Москва, ул. Академика Королева 10";"-";"-";"-";"М";"-";"-";"-"
"ТО-2691";"ИП Преображенская Мария Владимировна/(магазин одежды MAXLINE)";"Москва г, Лётчика Бабушкина., дом № 21/2";"-";"-";"-";"КВ";"-";"-";"-"
"ТО-2791";"ИП Кречетова Екатерина Николаевна";"Москва г, Милашенкова ул, дом № 5, корпус 1";"-";"-";"-";"КВ";"-";"-";"-"
"ТО-2799";"ИП Саргсян Эдвард Варужанович (Офисное помещение сантехнического оборудования)";"Москва г, Лётчика Бабушкина ул, дом 21/2 3";"-";"-";"-";"КВ";"-";"-";"-"
"ТО-2800";"ИП Кожанов Максим Сергеевич Школа английского языка О’KEY English";"Московская обл, г. Мытищи, ул. Борисовка, дом 16А";"-";"-";"-";"КВ";"-";"-";"-"
"ТО-2801";"ООО Хелима Рус склад";"МО г Мытищи ш. Волковское, вл 15В, стр. 1";"-";"-";"-";"КВ";"-";"-";"-"
"ТО-2804";"ООО «РЕНТ ЦЕНТРАЛЬ»/ Ломбард Благо";"Москва г, Енисейская ул, дом 17, корпус 1";"-";"-";"-";"КВ";"-";"-";"-"
"ТО-2807";"ООО «РЕНТ ЦЕНТРАЛЬ»/ Ломбард Благо";"Москва г, Снежная ул, дом 21/1";"-";"-";"-";"КВ";"-";"-";"-"
"ТО-2808";"ООО «РЕНТ ЦЕНТРАЛЬ»/ Ломбард Благо";"Москва г, Дежнева пр, дом 29, корпус 1";"-";"-";"-";"КВ";"-";"-";"-"
"ТО-2816";"ИП Камуркина Е.Н. (Детский лофт «MURLOFTIK»)";"Москва г, Нововладыкинский проезд, дом 1, корпус 2";"-";"-";"-";"КВ";"-";"-";"-"
"ТО-2826";"ИП Гришаева Ирина Павловна";"Москва г, Милашенкова ул, дом 7, корпус 1";"-";"-";"-";"КВ";"-";"-";"-"
"ТО-№390";"ИП Абрамова Ангелина Александровна/«Барбершоп/Школа парикмахеров»";"Москва г, Бескудниковский б-р, дом № 10, корпус 5";"-";"-";"-";"КВ";"-";"-";"-"
"ТО-№528ТБ";"ИП Земляков Игорь Николаевич /Магазин разливного пива ""Место Пиво""";"г. Москва, ул. Сельскохозяйственная, 35";"-";"-";"-";"КВ";"-";"-";"-"
"ТО-№638ТБ";"ООО «ДИВА ДЕНТ»/Стоматология";"Москва г, Олонецкая ул, дом № 4";"-";"-";"-";"КВ";"-";"-";"-"
"ТО-№752ТБ";"ООО «НСТ Инжиниринг» (Медицинский центр «Клиника 24»)";"Мытищи г, Подольниха д, КП «Зеленый Мыс», ул. Клубная, владение № 6, строение 1";"-";"-";"-";"КВ";"-";"-";"-"
"ТО-№794ТБ";"ИП Шамсутдинов Нематулло Рахматуллаевич/Пекарня )";"Королев г.,ул Пионерская, д. 8г";"-";"-";"-";"КВ";"-";"-";"-"
"№696ТБ";"ООО «СЕТЕВОЙ ДЕВЕЛОПМЕНТ»/Французская пекарня French Bakery Седелис,";"Москва г, Новодмитровская ул 2к2";"-";"-";"-";"КВ";"-";"-";"-"
"№719ТБ";"Раши Александра Сергеевна/Автозапчасти,";"Москва г, Нововладыкинский проезд, дом № 1, корпус 1";"-";"-";"-";"КВ";"-";"-";"-