п/н";"Объект";"Адрес";"Округ";"Компания";"Менеджер";"Период обслуживания";"Latitude";"Longitude";"Дата последнего ТО"
"93107";"аптека ""Планета Здоровья""";"Москва Пресненский Вал 4/29 с2";"ЦАО";"Гранит";"Пряшников Д.";"М";"55.7636";"37.564853";"28.05.2024"
"90727";"Аптека ""Планета Здоровья""";"Москва, Трехгорный вал 18";"ЦАО";"Гранит";"Пряшников Д.";"М";"55.7608895";"37.5618142";"28.05.2024"
"93113";"Аптека ""Планета Здоровья""";"Москва ул. Садовая самотечная 24/27";"ЦАО";"Гранит";"Пряшников Д.";"М";"55.773588";"37.618138";"02.05.2024"
"93113";"Аптека ""Планета Здоровья""";"Москва ул. Садовая самотечная 24/27";"ЦАО";"Гранит";"Пряшников Д.";"М";"55.773588";"37.618138";"02.05.2024"
"1515";"ООО ""Клиника Профессионал""";"Москва, Трубниковский пер., дом 8/15";"ЦАО";"Нева-Технологии";"Епуре А.А.";"М";"55.75131099999999";"37.58724";"19.05.2024"
"№41448";"Институт репродуктивной медицины ""REMEDI""";"Москва Шмитовский проезд, д. 3, стр. 1";"ЦАО";"-";"-";"КВ";"55.7582278";"37.5555547";"13.05.2024"
"82147";"ИП Агрба Фатима Ковиковна Ателье";"Москва, Смоленская набережная, дом 5/13";"ЦАО";"Аллигатор";"Ахметвалиева В.";"КВ";"55.7491539";"37.5767194";"02.05.2024"
"137405";"магазин иконописной мастерской ""Наследие""";"Москва Большая Якиманка, д. 19";"ЦАО";"-";"-";"КВ";"55.73792419999999";"37.6155542";"Новый 22.04"
"137602";"ИП Гальцов Денис Васильевич / Кофейня ""Surf Coffee""";"Москва пер Весковский, д. 3";"ЦАО";"-";"-";"КВ";"55.7808094";"37.5968493";"Новый 25.04"
"№ 856ТБ";"ИП Кяримов Ариф Мустафа Оглы, Французская Пекарня""Френч Баккери Седелис""";"Москва ул Новослободская, д. 10/9, стр. 1";"ЦАО";"-";"-";"КВ";"55.7805328";"37.6002778";"Новый 23.04"
"№ 129 ТБ";"ООО «Гости Рест»/(Ресторан «Guests food & bar»";"Москва г, вн.тер.г. муниципальный округ Хамовники, наб Пречистенская, д. 15, стр. 2";"ЦАО";"-";"-";"КВ";"55.73885";"37.60539440000001";"Новый 06.05"
"137617";"ИП Данилов Андрей Николаевич/Пекарня ";"Москва г, вн.тер.г. муниципальный округ Тверской, ул Селезневская, д. 34";"ЦАО";"-";"-";"КВ";"55.7810145";"37.6129963";"Новый 06.05"
"137570";"ООО «МИГДАЛЬ», Розничный магазин LÉAH пляжная одежда и купальники";"Москва г, вн.тер.г. муниципальный округ Пресненский, пер Козихинский Б., д. 1/9, стр. 1";"ЦАО";"-";"-";"КВ";"55.76487160000001";"37.6002672";"Новый ,монтаж не выполнен"
"1672";"ИП Демидов Андрей Вадимович / магазин одежды «Unique Fabric» ";"Москва г, ул Земляной Вал, д. 42/20";"ЦАО";"-";"-";"КВ";"55.7545435";"37.6562729";" новый 27.04"
"19392";"Тату-салон ""Дракон"" г. I (ИП Цыпкина?)";"Москва Арбат 20";"ЦАО";"Гранит";"Супонников М.С.";"КВ";"55.7502163";"37.5934269";"25.04.2024"
"1304";"ИП Долгова Лидия Васильевна /(магазин)";"Москва г, Смоленская наб, дом 2";"ЦАО";"Технологии Безопасности";"Саилова А.";"КВ";"55.7471362";"37.5767489";"23.04.2024"
"133113";"ИП Аванесова Э.А. (Магазин одежды STEFANISET)";"Москва г, Тараса Шевченко наб, 3";"ЦАО";"Гранит";"Калиниченко А.С.";"КВ";"55.7490176";"37.5717716";"23.04.2024"
"81964";"Мед. центр Инвитро, ООО ""АРМИНГ""";"г. Москва, Б. Дорогомиловская, дом. 6";"ЦАО";"Аллигатор";"Супонников М.С.";"КВ";"55.7457314";"37.5695236";"19.04.2024"
"133515";"ООО МКК «Скорость Финанс», офис «Деньги Сразу»";"Москва г, Дорогомиловская Б. ул, дом 1";"ЦАО";"Технологии Безопасности";"Шайхиев А. А.";"КВ";"55.6749928";"37.6712311";"19.04.2024"
"91886";"ПК «ВИА РИНАЛЬДИ» (Ресторан Via Rinaldi)";"Москва г, Можайский Вал ул, дом 6, строение 2";"ЦАО";"Технологии Безопасности";"Калиниченко А.С.";"КВ";"55.744939";"37.556957";"19.04.2024"
"№ 907ТБ";"ООО «Бизнес Проект» / Салон красоты";"Москва г, улица Садовая-Черногрязская, д. 3Б";"ЦАО";"-";"-";"КВ";"55.76744830000001";"37.6530862";"Новый объект